{
  "$schema": "https://json-schema.org/draft/2020-12/schema",
  "$id": "https://tesserae.local/schema/plugin.schema.json",
  "title": "Tesserae plugin manifest",
  "description": "Shape of plugin.json. See docs/contracts/plugins.md for the prose contract.",
  "type": "object",
  "required": ["tesserae_compat", "name", "version", "kind", "supports"],
  "properties": {
    "tesserae_compat": {
      "type": "string",
      "pattern": "^\\d+\\.(x|\\d+)(\\..*)?$",
      "description": "Major version range this plugin works against (e.g. '1.x'). The loader rejects mismatches."
    },
    "name": {
      "type": "string",
      "minLength": 1
    },
    "version": {
      "type": "string",
      "pattern": "^\\d+\\.\\d+\\.\\d+(?:[-+].*)?$"
    },
    "kind": {
      "enum": ["widget", "font", "admin", "data", "service"]
    },
    "description": {
      "type": "string"
    },
    "icon": {
      "type": "string",
      "description": "Phosphor icon class (e.g. 'ph-list-checks').",
      "pattern": "^ph-[a-z0-9-]+$"
    },
    "supports": {
      "type": "object",
      "required": ["sizes"],
      "properties": {
        "sizes": {
          "type": "array",
          "items": { "enum": ["xs", "sm", "md", "lg"] },
          "uniqueItems": true
        },
        "panels": {
          "type": "array",
          "items": { "type": "string" }
        }
      }
    },
    "fragments": {
      "type": "array",
      "description": "Named, independently-placeable pieces of the widget for the Panels canvas editor. render() paints just one when it receives ctx.fragment; a widget with no fragments (or ctx.fragment absent) renders the whole widget. Declaring fragments lets a user drop, say, just the temperature or the sun-times of a weather widget onto the canvas. See docs/dev/writing-a-widget.md.",
      "items": {
        "type": "object",
        "required": ["id", "label"],
        "properties": {
          "id": {
            "type": "string",
            "pattern": "^[a-z][a-z0-9_]*$",
            "description": "Fragment id passed to render() as ctx.fragment. 'full' is reserved for the whole widget."
          },
          "label": { "type": "string" },
          "icon": { "type": "string", "pattern": "^ph-[a-z0-9-]+$" },
          "w": { "type": "integer", "minimum": 1, "description": "Default placement width in px." },
          "h": { "type": "integer", "minimum": 1, "description": "Default placement height in px." }
        }
      }
    },
    "cell_options": {
      "type": "array",
      "items": {
        "type": "object",
        "required": ["name", "type", "label"],
        "properties": {
          "name": { "type": "string" },
          "type": { "enum": ["string", "textarea", "variables_textarea", "entity_overrides", "location_search", "number", "slider", "select", "multiselect", "boolean", "color"] },
          "label": { "type": "string" },
          "default": {},
          "secret": {
            "type": "boolean",
            "description": "The value is sensitive: it is stripped from the render context handed to the browser and redacted (with an installer question suggested in its place) when the dashboard is shared to the catalog."
          },
          "mask": {
            "type": "boolean",
            "description": "Render the editor field as a password input. Defaults to the value of 'secret'. Set false on a sensitive value the author still has to be able to read to maintain, such as a URL."
          },
          "choices": {
            "type": "array",
            "items": {
              "type": "object",
              "required": ["value", "label"],
              "properties": {
                "value": {},
                "label": { "type": "string" },
                "group": { "type": "string" },
                "image": {
                  "type": "string",
                  "description": "A picture of the choice (a path on this server such as /plugins/<id>/static/x.jpg, or an https URL). When any choice of a select has one, the editor shows a picture picker instead of a plain dropdown."
                },
                "image_large": {
                  "type": "string",
                  "description": "A bigger copy of image, shown when the picker's picture is enlarged. Defaults to image."
                }
              }
            }
          },
          "choices_from": { "type": "string" },
          "presets": {
            "type": "array",
            "description": "For a textarea: an Examples dropdown above it; picking one fills the textarea with the preset's value, to be edited from there.",
            "items": {
              "type": "object",
              "required": ["label", "value"],
              "properties": { "label": { "type": "string" }, "value": { "type": "string" } }
            }
          },
          "fill_from": {
            "type": "object",
            "description": "Another option owns this field's value; the editor fills it and locks it. Resolved server-side, so the field updates on reload after a save rather than the instant the controlling option changes. See docs/widgets.md.",
            "required": ["option", "map"],
            "properties": {
              "option": { "type": "string", "description": "Name of the controlling cell option." },
              "map": { "type": "object", "description": "Controlling value -> value for this field." }
            }
          },
          "show_if": {
            "type": "object",
            "description": "Show this field only when other options match. Keys are option names, every key must match. A value is an exact match, a list is any-of, and {\"not\": value-or-list} is none-of. A field whose controlling option is hidden is hidden too. Hidden fields keep their value. See docs/widgets.md.",
            "minProperties": 1,
            "additionalProperties": {
              "anyOf": [
                { "type": ["string", "number", "boolean", "null"] },
                { "type": "array", "items": { "type": ["string", "number", "boolean", "null"] } },
                {
                  "type": "object",
                  "required": ["not"],
                  "additionalProperties": false,
                  "properties": {
                    "not": {
                      "anyOf": [
                        { "type": ["string", "number", "boolean", "null"] },
                        { "type": "array", "items": { "type": ["string", "number", "boolean", "null"] } }
                      ]
                    }
                  }
                }
              ]
            }
          },
          "advanced": {
            "type": "boolean",
            "description": "Fine-tuning a typical user never needs to touch (refresh interval, title, text size, typeface, sort order and the like). Tesserae renders these last, in manifest order, inside a collapsed \"More options\" section at the end of the options form. show_if still applies inside it. An older Tesserae ignores the key and shows the option as usual. See docs/widgets.md."
          },
          "help": { "type": "string" }
        }
      }
    },
    "settings": {
      "type": "array",
      "items": {
        "type": "object",
        "required": ["name", "type", "label"],
        "properties": {
          "name": { "type": "string" },
          "type": { "type": "string" },
          "label": { "type": "string" },
          "secret": {
            "type": "boolean",
            "description": "When true, this field is saved to settings.json as '<name>_secret' so disk-grepping reveals which values are sensitive."
          },
          "advanced": {
            "type": "boolean",
            "description": "As on cell_options: render this setting last, inside the collapsed \"More options\" section of the widget's settings card."
          },
          "default": {}
        }
      }
    },
    "data_schema": {
      "type": "object",
      "description": "Declares the widget's fetch() data shape so the Panels canvas editor can offer its fields as bindable data sources. Optional: a widget without this block still renders normally but has no bindable fields in the composer. See docs/dev/writing-a-widget.md.",
      "required": ["fields"],
      "properties": {
        "color": {
          "type": "string",
          "description": "Optional accent colour for the widget's card in the composer Data panel."
        },
        "fields": {
          "type": "array",
          "description": "The bindable fields, one per top-level fetch() result key worth exposing.",
          "items": {
            "type": "object",
            "required": ["name", "type"],
            "properties": {
              "name": { "type": "string", "description": "The fetch() result key." },
              "type": {
                "enum": ["num", "str", "arr"],
                "description": "num (number), str (text/state), or arr (list, e.g. a series or item list)."
              },
              "label": { "type": "string", "description": "Human-friendly field name shown in the bind list." },
              "unit": { "type": "string", "description": "Optional unit hint (e.g. 'deg', '%', 's')." }
            }
          }
        },
        "sample": {
          "type": "object",
          "description": "Representative values keyed by field name, matching fetch()'s shape. Powers the editor's live preview and the render fallback when a source isn't configured yet."
        }
      }
    },
    "render": {
      "type": "object",
      "properties": {
        "dither": { "enum": ["none", "floyd-steinberg", "ordered"] },
        "full_bleed": { "type": "boolean" },
        "needs_network": { "type": "boolean" }
      }
    },
    "updates": {
      "type": "object",
      "description": "Declares host-owned update triggers this widget supports. A declaration only makes the matching per-placement opt-in available; it never refreshes a dashboard by itself.",
      "anyOf": [
        { "required": ["on_change"] },
        { "required": ["on_schedule"] }
      ],
      "additionalProperties": false,
      "properties": {
        "on_change": {
          "type": "array",
          "description": "Data sources that may refresh an opted-in placement. selector_option optionally narrows an event to the placement's selected cell option value.",
          "minItems": 1,
          "uniqueItems": true,
          "items": {
            "type": "object",
            "required": ["source"],
            "additionalProperties": false,
            "properties": {
              "source": {
                "type": "string",
                "pattern": "^[a-z][a-z0-9_.-]*$",
                "description": "Stable server data-change source id, for example personal_data.reminders."
              },
              "selector_option": {
                "type": "string",
                "minLength": 1,
                "maxLength": 128,
                "description": "Optional cell_options name whose saved value narrows the dependency, for example list_id."
              }
            }
          }
        },
        "on_schedule": {
          "type": "array",
          "description": "Scheduled refresh kinds supported by this widget. suggested_at only prefills the optional custom-time control; omitting a placement time means the local day boundary.",
          "minItems": 1,
          "uniqueItems": true,
          "items": {
            "type": "object",
            "required": ["kind"],
            "additionalProperties": false,
            "properties": {
              "kind": { "const": "daily" },
              "suggested_at": {
                "type": "string",
                "pattern": "^(?:[01][0-9]|2[0-3]):[0-5][0-9]$",
                "description": "Optional HH:MM prefill for a user-selected custom time."
              }
            }
          }
        }
      }
    },
    "design": {
      "type": "object",
      "description": "Design-system intent. Default for every field is the strict, palette-safe behaviour; opt-in values signal a widget is using a richer surface and accepts the downstream trade-offs.",
      "properties": {
        "palette": {
          "enum": ["strict", "extended"],
          "default": "strict",
          "description": "`strict` (default): the widget only uses Spectra colour tokens (`--w-orange`, `--w-blue`, etc.), so the rendered output lands cleanly on every supported panel without dithering. `extended`: the widget uses arbitrary CSS colours and relies on the renderer's Floyd-Steinberg pass to approximate them on the panel palette. Good for scenic/decorative widgets (gradients, soft scenery); read worse on BW panels than strict widgets. Catalog reviewers should see this flag and treat extended widgets as taking on the dither-tradeoff responsibility."
        }
      }
    },
    "requires": {
      "type": "array",
      "items": {
        "type": "string",
        "pattern": "^(network|settings|filesystem|plugin):[A-Za-z0-9_./*-]+$"
      },
      "uniqueItems": true,
      "description": "Declared capability list. Each entry is `<category>:<value>`. Supported categories: `network:<hostname>` (specific egress target; `network:*` for unrestricted but flagged in review), `settings:plugin` (own plugin settings, the common case; `settings:plugin/<other_id>` for a sibling's; `settings:app` for top-level app settings like lat/lon), `filesystem:write:<path>` (write outside data_dir; reads are implicit for data_dir and the plugin folder), `plugin:<other_id>` (this widget fetches through another plugin, so that plugin's declared hosts are allowed while this one runs; needed because the delegate's request happens inside this widget's capability scope). Enforcement in v1: network egress is blocked at the socket layer for hostnames not in the list; settings + filesystem entries are review-only. Widgets without a `requires:` block load with no enforcement (existing behaviour) but should declare in new submissions, the catalog review checklist demands it."
    },
    "locales": {
      "type": "array",
      "description": "locale tags this widget ships panel text for (e.g. 'en', 'fr', 'pt-BR'). Each tag must have a matching strings/<tag>.json file next to plugin.json, a flat { \"key\": \"translated text\" } map. A widget's own hardcoded fallback text is always assumed to be English; strings/en.json is what a locale with no exact or base-language match falls back to. The host resolves the active locale (per device, falling back to the app default) and hands the widget ctx.locale + ctx.strings/ctx.t() at render time. See docs/widgets.md#locales-strings.",
      "items": { "type": "string", "pattern": "^[a-z]{2,3}(-[A-Z]{2})?\\Z" },
      "minItems": 1,
      "uniqueItems": true
    },
    "fonts": {
      "type": "array",
      "items": {
        "type": "object",
        "required": ["id", "name", "weights", "files"],
        "properties": {
          "id": { "type": "string", "pattern": "^[a-z][a-z0-9_-]*$" },
          "name": { "type": "string", "minLength": 1 },
          "category": { "enum": ["sans", "serif", "mono", "display", "handwriting"] },
          "weights": {
            "type": "array",
            "items": { "type": "integer", "minimum": 100, "maximum": 900 },
            "minItems": 1
          },
          "files": {
            "type": "object",
            "additionalProperties": { "type": "string" }
          }
        }
      }
    }
  },
  "allOf": [
    {
      "description": "Placeable widgets must declare at least one size; non-placeable kinds (service, data, font, admin) may leave supports.sizes empty.",
      "if": { "properties": { "kind": { "const": "widget" } } },
      "then": { "properties": { "supports": { "properties": { "sizes": { "minItems": 1 } } } } }
    },
    {
      "description": "Only placeable widgets may declare update capabilities.",
      "if": { "required": ["updates"] },
      "then": { "properties": { "kind": { "const": "widget" } } }
    },
    {
      "description": "Only placeable widgets render panel text, so only they may declare locales.",
      "if": { "required": ["locales"] },
      "then": { "properties": { "kind": { "const": "widget" } } }
    }
  ]
}
