{
  "tesserae_compat": "1.x",
  "name": "Home Assistant, Entities",
  "version": "0.8.1",
  "kind": "widget",
  "locales": ["en", "cs", "de", "es", "fr", "it", "lt", "nb", "nl", "pl", "pt", "sk", "sv", "zh-CN", "zh-TW"],
  "description": "A status grid of several Home Assistant entities. Each row tints by its state (on / off / other), leads with a device-class-aware Phosphor glyph (temperature → thermometer, CO₂ → wind, motion → person walking, …), and shows its current value. Rows that changed within the last 10 minutes pick up an accent-4 wash + a 'just now' / 'Nm ago' badge.",
  "icon": "ph-squares-four",
  "supports": {
    "sizes": [
      "sm",
      "md",
      "lg"
    ]
  },
  "cell_options": [
    {
      "name": "entities",
      "type": "multiselect",
      "label": "Entities",
      "default": [],
      "choices_from": "entity"
    },
    {
      "name": "overrides",
      "type": "entity_overrides",
      "label": "Names, icons and formats",
      "default": "",
      "formats": true,
      "help": "One row per ticked entity. Leave the name blank to keep the auto label; pick \"No icon\" to keep the auto icon. The format box overrides the widget number format for that entity (blank = use the widget default)."
    },
    {
      "name": "show_last_updated",
      "type": "boolean",
      "label": "Last updated",
      "default": true,
      "help": "Off hides the 'just now' / 'Nm ago' badge on recently changed rows and the changed count in the title row. On shows both for rows that changed within the last 10 minutes."
    },
    {
      "name": "show_title",
      "type": "boolean",
      "label": "Title line",
      "default": true,
      "advanced": true,
      "help": "Off hides the whole title row (icon + title + count)."
    },
    {
      "name": "title",
      "type": "string",
      "label": "Title",
      "default": "Entities",
      "show_if": {
        "show_title": true
      },
      "advanced": true
    },
    {
      "name": "show_names",
      "type": "boolean",
      "label": "Names",
      "default": true,
      "advanced": true,
      "help": "Off hides the per-row entity name, leaving icon + value."
    },
    {
      "name": "number_format",
      "type": "string",
      "label": "Number format",
      "default": "",
      "advanced": true,
      "placeholder": "auto (e.g. 0, 0.0, 0.00)",
      "help": "How numeric values are shown. Blank rounds to 2 decimals and trims trailing zeros (21.00 → 21). Use 0 for whole numbers, 0.0 for one decimal, 0.00 for two, and so on. Per-entity formats live in Names, icons and formats."
    }
  ],
  "render": {
    "dither": "none",
    "needs_network": true
  }
}
