{
  "tesserae_compat": "1.x",
  "name": "Todo",
  "version": "0.1.2",
  "kind": "widget",
  "locales": ["en", "cs", "de", "es", "fr", "it", "lt", "nb", "nl", "pl", "pt", "sk", "sv", "zh-CN", "zh-TW"],
  "description": "Persistent todo lists. Create lists and add items on the admin page (Widgets \u2192 Todo); the widget cell renders the chosen list as a read-only checklist. Completed items auto-prune after 24 hours so the list doesn't grow indefinitely.",
  "icon": "ph-list-checks",
  "supports": {
    "sizes": [
      "xs",
      "sm",
      "md",
      "lg"
    ]
  },
  "cell_options": [
    {
      "name": "list_id",
      "type": "select",
      "label": "List",
      "choices_from": "lists"
    },
    {
      "name": "max_items",
      "type": "number",
      "label": "How many",
      "default": 0,
      "help": "0 shows every item."
    },
    {
      "name": "show_completed",
      "type": "boolean",
      "label": "Completed items",
      "default": true,
      "help": "Items completed in the last 24 hours."
    }
  ],
  "render": {
    "dither": "none",
    "needs_network": false
  }
}
