{
  "tesserae_compat": "1.x",
  "name": "Clock, Word",
  "version": "0.1.2",
  "kind": "widget",
  "locales": ["en", "cs", "de", "es", "fr", "it", "lt", "nb", "nl", "pl", "pt", "sk", "sv", "zh-CN", "zh-TW"],
  "description": "Word clock, reads the time as English text, rounded to the nearest five minutes ('Twenty past three'). Pure client-side, ticks every 30 seconds.",
  "icon": "ph-text-aa",
  "supports": { "sizes": ["xs", "sm", "md", "lg"] },
  "cell_options": [
    {
      "name": "show_seconds_dot",
      "type": "boolean",
      "label": "Seconds dot",
      "default": true,
      "help": "A pulsing dot for the seconds."
    },
    {
      "name": "show_tone",
      "type": "boolean",
      "label": "Time-of-day tint",
      "default": true,
      "help": "Tints the background with the phase of the day."
    },
    {
      "name": "show_phase_badge",
      "type": "boolean",
      "label": "Time-of-day badge",
      "default": true,
      "help": "Morning, afternoon, evening or night."
    }
  ],
  "render": { "dither": "none", "needs_network": false }
}
