{
  "tesserae_compat": "1.x",
  "name": "Clock, Sunrise / Sunset",
  "version": "0.1.8",
  "kind": "widget",
  "locales": ["en", "cs", "de", "es", "fr", "it", "lt", "nb", "nl", "pl", "pt", "sk", "sv", "zh-CN", "zh-TW"],
  "description": "Today's sunrise, sunset, golden hour, and day length for a chosen lat/lon. The hero shows a sun-arc visualisation with the current position marked. Data from Open-Meteo (no key).",
  "icon": "ph-sun-horizon",
  "supports": {
    "sizes": [
      "sm",
      "md",
      "lg"
    ]
  },
  "cell_options": [
    {
      "name": "location",
      "type": "location_search",
      "label": "Place",
      "default": "",
      "help": "Search a city, or paste a 'lat, lon' pair ('-37.85, 144.94'), to set the location. The latitude / longitude that drive the weather data come from the picked result; the Place name below auto-fills with the city name (or the coordinates)."
    },
    {
      "name": "label",
      "type": "string",
      "label": "Place name",
      "default": "",
      "help": "Auto-filled from the place you pick; edit it to customise (for example 'Home' instead of 'Berlin')."
    },
    {
      "name": "show_arc",
      "type": "boolean",
      "label": "Sun path",
      "default": true
    },
    {
      "name": "show_golden",
      "type": "boolean",
      "label": "Golden hour",
      "default": true
    },
    {
      "name": "show_twilight",
      "type": "boolean",
      "label": "Twilight",
      "default": true,
      "help": "Tints the civil, nautical and astronomical twilight bands beyond the horizon."
    }
  ],
  "render": {
    "dither": "none",
    "needs_network": true
  },
  "requires": [
    "network:api.open-meteo.com"
  ],
  "data_schema": {
    "color": "#3F5A88",
    "fields": [
      {
        "name": "label",
        "type": "str",
        "label": "Place"
      },
      {
        "name": "tz",
        "type": "str",
        "label": "Timezone"
      },
      {
        "name": "sunrise",
        "type": "str",
        "label": "Sunrise"
      },
      {
        "name": "sunset",
        "type": "str",
        "label": "Sunset"
      },
      {
        "name": "daylight_seconds",
        "type": "num",
        "label": "Daylight",
        "unit": "s"
      }
    ],
    "sample": {
      "label": "Melbourne",
      "tz": "Australia/Melbourne",
      "sunrise": "07:12",
      "sunset": "17:38",
      "daylight_seconds": 37560
    }
  }
}
