{
  "tesserae_compat": "1.x",
  "name": "Weather, Now",
  "version": "0.1.12",
  "kind": "widget",
  "description": "Current conditions plus feels-like, humidity, wind, UV and sun times. Data from Open-Meteo (no API key required).",
  "icon": "ph-cloud-sun",
  "locales": ["en", "cs", "de", "es", "fr", "it", "lt", "nb", "nl", "pl", "pt", "sk", "sv", "zh-CN", "zh-TW"],
  "supports": {
    "sizes": [
      "xs",
      "sm",
      "md",
      "lg"
    ]
  },
  "cell_options": [
    {
      "name": "location",
      "type": "location_search",
      "label": "Place",
      "default": "",
      "help": "Search a city, or paste a 'lat, lon' pair ('-37.85, 144.94'), to set the location. The latitude / longitude that drive the weather data come from the picked result; the Place name below auto-fills with the city name (or the coordinates). Set programmatically (e.g. via MCP), location also accepts a bare place name ('South Morang'), a 'City, CC' form ('Paris, FR'), or a literal 'lat,lon' pair ('-37.65,145.09')."
    },
    {
      "name": "label",
      "type": "string",
      "label": "Place name",
      "default": "",
      "help": "Auto-filled from the place you pick; edit it to customise (for example 'Home' instead of 'Berlin')."
    },
    {
      "name": "units",
      "type": "select",
      "label": "Units",
      "default": "metric",
      "choices": [
        {
          "value": "metric",
          "label": "Metric (\u00b0C, km/h)"
        },
        {
          "value": "imperial",
          "label": "Imperial (\u00b0F, mph)"
        }
      ]
    }
  ],
  "render": {
    "dither": "none",
    "needs_network": true
  },
  "requires": [
    "network:api.open-meteo.com"
  ],
  "fragments": [
    { "id": "full", "label": "Full card", "w": 320, "h": 200, "icon": "ph-cloud-sun" },
    { "id": "temp", "label": "Temperature", "w": 180, "h": 120, "icon": "ph-thermometer-simple" },
    { "id": "metrics", "label": "Metrics strip", "w": 300, "h": 90, "icon": "ph-gauge" },
    { "id": "sun", "label": "Sun times", "w": 160, "h": 150, "icon": "ph-sun-horizon" }
  ]
}
