{
  "tesserae_compat": "1.x",
  "name": "Home Assistant, History",
  "version": "0.8.2",
  "kind": "widget",
  "locales": ["en", "cs", "de", "es", "fr", "it", "lt", "nb", "nl", "pl", "pt", "sk", "sv", "zh-CN", "zh-TW"],
  "description": "A numeric Home Assistant sensor over time. Pairs the current value + trend arrow + min/max (in the legend strip, or as a large headline above the chart) with a Chart.js line chart, optional threshold horizontal line, optional fixed y-axis range, min/max marker dots + labels on the curve, and an averaged hourly-profile ghost overlay for long windows. Requires the Home Assistant Core plugin.",
  "icon": "ph-chart-line",
  "supports": {
    "sizes": [
      "sm",
      "md",
      "lg"
    ]
  },
  "cell_options": [
    {
      "name": "entities",
      "type": "multiselect",
      "label": "Entities",
      "default": [],
      "choices_from": "entity"
    },
    {
      "name": "window",
      "type": "select",
      "label": "Window",
      "default": "24",
      "choices": [
        {
          "value": "6",
          "label": "Last 6 hours"
        },
        {
          "value": "12",
          "label": "Last 12 hours"
        },
        {
          "value": "24",
          "label": "Last 24 hours"
        },
        {
          "value": "72",
          "label": "Last 3 days"
        },
        {
          "value": "168",
          "label": "Last week"
        },
        {
          "value": "336",
          "label": "Last 2 weeks"
        },
        {
          "value": "720",
          "label": "Last month"
        },
        {
          "value": "2160",
          "label": "Last 3 months"
        }
      ]
    },
    {
      "name": "value_style",
      "type": "select",
      "label": "Current value",
      "default": "legend",
      "choices": [
        {
          "value": "legend",
          "label": "In the legend strip under the chart"
        },
        {
          "value": "headline",
          "label": "Large headline above the chart"
        }
      ],
      "help": "Where the single-sensor current reading goes. Headline puts it in large type above the chart, with the trend arrow and low / high beside it, for a reading you want at a glance plus the history for context."
    },
    {
      "name": "title",
      "type": "string",
      "label": "Title",
      "default": "",
      "advanced": true,
      "help": "Blank uses the entity name, or History for several."
    },
    {
      "name": "number_format",
      "type": "string",
      "label": "Number format",
      "default": "",
      "advanced": true,
      "placeholder": "auto (e.g. 0, 0.0, 0.00)",
      "help": "How the current / min / max values are shown. Blank rounds to 2 decimals and trims trailing zeros (21.00 → 21). Use 0 for whole numbers, 0.0 for one decimal, 0.00 for two, and so on."
    },
    {
      "name": "threshold",
      "type": "number",
      "label": "Threshold",
      "default": "",
      "advanced": true,
      "help": "Optional. Draws a horizontal dashed line at this value. Useful for 'too cold' / 'too high' / 'over budget' thresholds."
    },
    {
      "name": "y_min",
      "type": "number",
      "label": "Y-axis minimum",
      "default": "",
      "advanced": true,
      "help": "Optional. Fixes the bottom of the chart's value axis. Blank lets the axis follow the data, which can make the same swing look bigger or smaller from one render to the next."
    },
    {
      "name": "y_max",
      "type": "number",
      "label": "Y-axis maximum",
      "default": "",
      "advanced": true,
      "help": "Optional. Fixes the top of the chart's value axis. Blank lets the axis follow the data. Set both to pin the range, for example 0 to 40 for an outdoor temperature."
    },
    {
      "name": "show_min_max",
      "type": "boolean",
      "label": "Min and max marks",
      "default": true,
      "advanced": true,
      "help": "Marks the lowest and highest points on the chart."
    },
    {
      "name": "show_profile",
      "type": "boolean",
      "label": "Hourly profile",
      "default": true,
      "advanced": true,
      "help": "An averaged hourly-profile overlay, on long windows."
    }
  ],
  "fragments": [
    { "id": "full", "label": "Full card", "w": 300, "h": 200, "icon": "ph-chart-line-up" },
    { "id": "chart", "label": "Chart only", "w": 280, "h": 150, "icon": "ph-chart-line" },
    { "id": "value", "label": "Current value", "w": 150, "h": 110, "icon": "ph-number-square-one" }
  ],
  "render": {
    "dither": "none",
    "needs_network": true
  }
}
