{
  "tesserae_compat": "1.x",
  "name": "Home Assistant, Lights",
  "version": "0.1.4",
  "kind": "widget",
  "locales": ["en", "cs", "de", "es", "fr", "it", "lt", "nb", "nl", "pl", "pt", "sk", "sv", "zh-CN", "zh-TW"],
  "description": "An at-a-glance overview of a room (or whole-house) set of light.* entities: which are on, how bright, what colour, and what share of the house is currently lit. Each row carries a brightness mini-bar tinted by the light's actual colour-temperature (warm-white to cool-white) or RGB hue, plus a swatch dot for the colour itself. Reads from your existing Home Assistant install via the Core plugin.",
  "icon": "ph-lightbulb",
  "supports": {
    "sizes": [
      "sm",
      "md",
      "lg"
    ]
  },
  "cell_options": [
    {
      "name": "entities",
      "type": "multiselect",
      "label": "Lights",
      "default": [],
      "choices_from": "entity",
      "help": "Blank shows every light in Home Assistant."
    },
    {
      "name": "label",
      "type": "string",
      "label": "Place name",
      "default": "Home"
    }
  ],
  "render": {
    "dither": "none",
    "needs_network": false
  }
}
